{
  "$schema": "https://json-schema.org/draft/2020-12/schema",
  "$id": "https://github.com/minsago-elite/decomp_thing/oracle/gcc/compiler-engines.schema.json",
  "title": "GCC compiler-engine reconstruction benchmark profile",
  "type": "object",
  "additionalProperties": false,
  "required": ["schemaVersion", "analysis", "benchmark", "provenance", "budgets", "engines"],
  "properties": {
    "schemaVersion": {"const": 1},
    "analysis": {
      "type": "object",
      "additionalProperties": false,
      "required": ["exporter", "ghidra", "planner"],
      "properties": {
        "cc1RuntimeDiagnostics": {
          "type": "object",
          "additionalProperties": false,
          "required": ["provider", "schemaVersion", "runtimeInvocationVersion", "workerOperation", "diagnosticPolicy", "processorCount", "analysisThreadCount", "decompilerWorkerCount", "maximumJavaHeapBytes", "maximumResidentBytes", "wallClockSeconds"],
          "properties": {
            "provider": {"const": "gcc-cc1-runtime-diagnostics-v1"},
            "schemaVersion": {"const": 1},
            "runtimeInvocationVersion": {"const": 7},
            "workerOperation": {"const": "analyze-diagnostics-v1"},
            "diagnosticPolicy": {"const": "jvm-mxbean-stdout-v1"},
            "processorCount": {"const": 4},
            "analysisThreadCount": {"const": 4},
            "decompilerWorkerCount": {"const": 4},
            "maximumJavaHeapBytes": {"const": 2147483648},
            "maximumResidentBytes": {"const": 17179869184},
            "wallClockSeconds": {"const": 9000}
          }
        },
        "fullRecoveryCc1Throughput": {
          "type": "object",
          "additionalProperties": false,
          "required": ["schemaVersion", "runtimeInvocationVersion", "processorCount", "analysisThreadCount", "decompilerWorkerCount"],
          "properties": {
            "schemaVersion": {"const": 1},
            "runtimeInvocationVersion": {"const": 6},
            "processorCount": {"const": 4},
            "analysisThreadCount": {"const": 4},
            "decompilerWorkerCount": {"const": 4}
          }
        },
        "exporter": {
          "type": "object",
          "additionalProperties": false,
          "required": ["id", "version", "sha256", "recoveryMode"],
          "properties": {
            "id": {"const": "decompengine-ghidra-program-model"},
            "version": {"const": 15},
            "recoveryMode": {"const": "planning"},
            "sha256": {"$ref": "#/$defs/sha256"}
          }
        },
        "ghidra": {
          "type": "object",
          "additionalProperties": false,
          "required": ["version", "release", "archiveFileName", "archiveBytes", "archiveSha256"],
          "properties": {
            "version": {"const": "12.1.3"},
            "release": {"const": "PUBLIC"},
            "archiveFileName": {"const": "ghidra_12.1.3_PUBLIC_20260817.zip"},
            "archiveBytes": {"const": 569445154},
            "archiveSha256": {"const": "93a5d11a9ad510622acaaf908c556a7b9b764d338e78a7567f3689bf5081fd54"}
          }
        },
        "planner": {
          "type": "object",
          "additionalProperties": false,
          "required": ["id", "version"],
          "properties": {
            "id": {"const": "deterministic-module-planner"},
            "version": {"const": 1}
          }
        }
      }
    },
    "benchmark": {
      "type": "object",
      "additionalProperties": false,
      "required": ["id", "version", "target"],
      "properties": {
        "id": {"const": "gcc-compiler-engines-16.2.0"},
        "version": {"const": "16.2.0"},
        "target": {"const": "x86_64-linux-gnu"}
      }
    },
    "provenance": {
      "type": "object",
      "additionalProperties": false,
      "required": ["sourceLockPath", "sourceLockSha256", "baseBuildRecordPath", "baseBuildRecordSha256", "toolchainReproductionPath", "toolchainReproductionSha256"],
      "properties": {
        "sourceLockPath": {"const": "source-lock.json"},
        "sourceLockSha256": {"$ref": "#/$defs/sha256"},
        "baseBuildRecordPath": {"const": "build-record.json"},
        "baseBuildRecordSha256": {"$ref": "#/$defs/sha256"},
        "toolchainReproductionPath": {"const": "toolchain-reproduction.json"},
        "toolchainReproductionSha256": {"$ref": "#/$defs/sha256"}
      }
    },
    "budgets": {
      "type": "object",
      "additionalProperties": false,
      "required": ["exportWallClockSeconds", "fullRecoveryCc1ExportWallClockSeconds", "exportMaximumResidentBytes", "plannerMaximumEntities", "plannerMaximumDependencyEdges", "plannerMaximumWorkUnits"],
      "properties": {
        "exportWallClockSeconds": {"const": 1800},
        "fullRecoveryCc1ExportWallClockSeconds": {"const": 9000},
        "exportMaximumResidentBytes": {"const": 17179869184},
        "plannerMaximumEntities": {"type": "integer", "minimum": 1},
        "plannerMaximumDependencyEdges": {"type": "integer", "minimum": 1},
        "plannerMaximumWorkUnits": {"type": "integer", "minimum": 1}
      }
    },
    "engines": {
      "type": "array",
      "minItems": 2,
      "maxItems": 2,
      "items": {
        "type": "object",
        "additionalProperties": false,
        "required": ["id", "buildOutput", "fullArtifact", "strippedArtifact", "buildRecord", "buildRecordSha256", "oracleManifest", "oracleManifestSha256", "functionOracle", "reconstructionArchive"],
        "properties": {
          "id": {"enum": ["cc1", "lto1"]},
          "buildOutput": {"type": "string", "pattern": "^/oracle/build/gcc/(cc1|lto1)$"},
          "fullArtifact": {"type": "string", "pattern": "^artifacts/gcc-(cc1|lto1)\\.full$"},
          "strippedArtifact": {"type": "string", "pattern": "^artifacts/gcc-(cc1|lto1)\\.stripped$"},
          "buildRecord": {"type": "string", "pattern": "^(cc1|lto1)-build-record\\.json$"},
          "buildRecordSha256": {"$ref": "#/$defs/sha256"},
          "oracleManifest": {"type": "string", "pattern": "^(cc1|lto1)-oracle-manifest\\.json$"},
          "oracleManifestSha256": {"$ref": "#/$defs/sha256"},
          "functionOracle": {"type": "string", "pattern": "^(cc1|lto1)-function-recovery-oracle\\.json$"},
          "reconstructionArchive": {"type": "string", "pattern": "^(cc1|lto1)-reconstruction\\.zip$"}
        }
      }
    }
  },
  "$defs": {"sha256": {"type": "string", "pattern": "^[0-9a-f]{64}$"}}
}
